{
  "schema_version": "0.3",
  "skeleton_id": "brickmen_broad_v0_skeleton",
  "architecture_id": "brickmen_broad_v0",
  "status": "concept_generation_skeleton_nonproduction",
  "coordinate_system": {
    "units": "normalized_body_height",
    "axes": {
      "x": "left_to_right",
      "y": "back_to_front",
      "z": "feet_to_head"
    },
    "origin": "midpoint_between_feet_on_ground"
  },
  "default_target_height_mm": 42,
  "parameters": {
    "shoulder_width_scale": {
      "default": 1,
      "min": 0.85,
      "max": 1.25
    },
    "arm_length_scale": {
      "default": 1,
      "min": 0.9,
      "max": 1.12
    },
    "torso_height_scale": {
      "default": 1,
      "min": 0.92,
      "max": 1.1
    },
    "lower_body_height_scale": {
      "default": 1,
      "min": 0.9,
      "max": 1.08
    },
    "stance_width_scale": {
      "default": 1,
      "min": 0.85,
      "max": 1.2
    },
    "head_height_scale": {
      "default": 1,
      "min": 0.75,
      "max": 1.4
    },
    "torso_depth_scale": {
      "default": 1,
      "min": 0.8,
      "max": 1.35
    },
    "abdomen_projection_scale": {
      "default": 1,
      "min": 0.75,
      "max": 1.4
    },
    "torso_width_scale": {
      "default": 1,
      "min": 0.65,
      "max": 2.5
    },
    "head_width_scale": {
      "default": 1,
      "min": 0.75,
      "max": 1.6
    },
    "head_depth_scale": {
      "default": 1,
      "min": 0.75,
      "max": 1.6
    },
    "abdomen_width_scale": {
      "default": 1,
      "min": 0.65,
      "max": 1.8
    },
    "lower_torso_length_scale": {
      "default": 1,
      "min": 0.8,
      "max": 1.25
    },
    "upper_torso_length_scale": {
      "default": 1,
      "min": 0.8,
      "max": 1.25
    },
    "neck_head_offset_scale": {
      "default": 1,
      "min": 0.8,
      "max": 1.25
    },
    "thigh_length_scale": {
      "default": 1,
      "min": 0.8,
      "max": 1.25
    },
    "shin_length_scale": {
      "default": 1,
      "min": 0.8,
      "max": 1.25
    }
  },
  "nodes": [
    {
      "id": "root",
      "position_norm": [
        0,
        0,
        0
      ],
      "role": "ground_root",
      "semantic_side": "center",
      "functional": false
    },
    {
      "id": "pelvis",
      "position_norm": [
        0,
        0,
        0.36
      ],
      "role": "pelvis_center",
      "semantic_side": "center",
      "functional": true
    },
    {
      "id": "waist",
      "position_norm": [
        0,
        0,
        0.44
      ],
      "role": "waist_interface",
      "semantic_side": "center",
      "functional": true
    },
    {
      "id": "chest",
      "position_norm": [
        0,
        0,
        0.62
      ],
      "role": "torso_mass_center",
      "semantic_side": "center",
      "functional": false
    },
    {
      "id": "neck",
      "position_norm": [
        0,
        0,
        0.78
      ],
      "role": "neck_interface",
      "semantic_side": "center",
      "functional": true
    },
    {
      "id": "head_center",
      "position_norm": [
        0,
        0,
        0.9
      ],
      "role": "head_center",
      "semantic_side": "center",
      "functional": false
    },
    {
      "id": "shoulder_l",
      "position_norm": [
        -0.185,
        0,
        0.7
      ],
      "role": "shoulder_joint",
      "semantic_side": "left",
      "functional": true
    },
    {
      "id": "elbow_l",
      "position_norm": [
        -0.235,
        0,
        0.57
      ],
      "role": "elbow_landmark",
      "semantic_side": "left",
      "functional": false
    },
    {
      "id": "wrist_l",
      "position_norm": [
        -0.245,
        0,
        0.44
      ],
      "role": "wrist_joint",
      "semantic_side": "left",
      "functional": true
    },
    {
      "id": "hand_l",
      "position_norm": [
        -0.255,
        0,
        0.39
      ],
      "role": "hand_center",
      "semantic_side": "left",
      "functional": false
    },
    {
      "id": "shoulder_r",
      "position_norm": [
        0.185,
        0,
        0.7
      ],
      "role": "shoulder_joint",
      "semantic_side": "right",
      "functional": true
    },
    {
      "id": "elbow_r",
      "position_norm": [
        0.235,
        0,
        0.57
      ],
      "role": "elbow_landmark",
      "semantic_side": "right",
      "functional": false
    },
    {
      "id": "wrist_r",
      "position_norm": [
        0.245,
        0,
        0.44
      ],
      "role": "wrist_joint",
      "semantic_side": "right",
      "functional": true
    },
    {
      "id": "hand_r",
      "position_norm": [
        0.255,
        0,
        0.39
      ],
      "role": "hand_center",
      "semantic_side": "right",
      "functional": false
    },
    {
      "id": "hip_l",
      "position_norm": [
        -0.065,
        0,
        0.34
      ],
      "role": "hip_landmark",
      "semantic_side": "left",
      "functional": true
    },
    {
      "id": "knee_l",
      "position_norm": [
        -0.065,
        0,
        0.18
      ],
      "role": "knee_landmark",
      "semantic_side": "left",
      "functional": false
    },
    {
      "id": "ankle_l",
      "position_norm": [
        -0.065,
        0,
        0.035
      ],
      "role": "foot_anchor",
      "semantic_side": "left",
      "functional": false
    },
    {
      "id": "hip_r",
      "position_norm": [
        0.065,
        0,
        0.34
      ],
      "role": "hip_landmark",
      "semantic_side": "right",
      "functional": true
    },
    {
      "id": "knee_r",
      "position_norm": [
        0.065,
        0,
        0.18
      ],
      "role": "knee_landmark",
      "semantic_side": "right",
      "functional": false
    },
    {
      "id": "ankle_r",
      "position_norm": [
        0.065,
        0,
        0.035
      ],
      "role": "foot_anchor",
      "semantic_side": "right",
      "functional": false
    }
  ],
  "bones": [
    {
      "id": "spine_lower",
      "a": "pelvis",
      "b": "waist",
      "role": "torso"
    },
    {
      "id": "spine_upper",
      "a": "waist",
      "b": "neck",
      "role": "torso"
    },
    {
      "id": "neck_head",
      "a": "neck",
      "b": "head_center",
      "role": "head"
    },
    {
      "id": "clavicle_l",
      "a": "chest",
      "b": "shoulder_l",
      "role": "upper_body"
    },
    {
      "id": "upper_arm_l",
      "a": "shoulder_l",
      "b": "elbow_l",
      "role": "arm"
    },
    {
      "id": "forearm_l",
      "a": "elbow_l",
      "b": "wrist_l",
      "role": "arm"
    },
    {
      "id": "hand_link_l",
      "a": "wrist_l",
      "b": "hand_l",
      "role": "hand"
    },
    {
      "id": "clavicle_r",
      "a": "chest",
      "b": "shoulder_r",
      "role": "upper_body"
    },
    {
      "id": "upper_arm_r",
      "a": "shoulder_r",
      "b": "elbow_r",
      "role": "arm"
    },
    {
      "id": "forearm_r",
      "a": "elbow_r",
      "b": "wrist_r",
      "role": "arm"
    },
    {
      "id": "hand_link_r",
      "a": "wrist_r",
      "b": "hand_r",
      "role": "hand"
    },
    {
      "id": "thigh_l",
      "a": "hip_l",
      "b": "knee_l",
      "role": "leg"
    },
    {
      "id": "shin_l",
      "a": "knee_l",
      "b": "ankle_l",
      "role": "leg"
    },
    {
      "id": "thigh_r",
      "a": "hip_r",
      "b": "knee_r",
      "role": "leg"
    },
    {
      "id": "shin_r",
      "a": "knee_r",
      "b": "ankle_r",
      "role": "leg"
    }
  ],
  "joints": [
    {
      "joint_id": "neck",
      "parent_node": "neck",
      "child_node": "head_center",
      "joint_type": "swivel_or_cartridge",
      "axis": [
        0,
        0,
        1
      ],
      "range_deg": [
        -180,
        180
      ],
      "functional": true,
      "production_interface_status": "unvalidated",
      "joint_cartridge_ref": null
    },
    {
      "joint_id": "shoulder_l",
      "parent_node": "chest",
      "child_node": "shoulder_l",
      "joint_type": "revolute_or_ball_cartridge",
      "axis": [
        1,
        0,
        0
      ],
      "range_deg": [
        -110,
        110
      ],
      "functional": true,
      "production_interface_status": "unvalidated",
      "joint_cartridge_ref": null
    },
    {
      "joint_id": "shoulder_r",
      "parent_node": "chest",
      "child_node": "shoulder_r",
      "joint_type": "revolute_or_ball_cartridge",
      "axis": [
        1,
        0,
        0
      ],
      "range_deg": [
        -110,
        110
      ],
      "functional": true,
      "production_interface_status": "unvalidated",
      "joint_cartridge_ref": null
    },
    {
      "joint_id": "wrist_l",
      "parent_node": "wrist_l",
      "child_node": "hand_l",
      "joint_type": "swivel_cartridge",
      "axis": [
        0,
        1,
        0
      ],
      "range_deg": [
        -180,
        180
      ],
      "functional": true,
      "production_interface_status": "unvalidated",
      "joint_cartridge_ref": null
    },
    {
      "joint_id": "wrist_r",
      "parent_node": "wrist_r",
      "child_node": "hand_r",
      "joint_type": "swivel_cartridge",
      "axis": [
        0,
        1,
        0
      ],
      "range_deg": [
        -180,
        180
      ],
      "functional": true,
      "production_interface_status": "unvalidated",
      "joint_cartridge_ref": null
    },
    {
      "joint_id": "waist",
      "parent_node": "pelvis",
      "child_node": "waist",
      "joint_type": "standard_lower_adapter_candidate",
      "axis": [
        0,
        0,
        1
      ],
      "range_deg": [
        0,
        0
      ],
      "functional": true,
      "production_interface_status": "unvalidated",
      "joint_cartridge_ref": null
    }
  ],
  "parameter_rules": [
    {
      "parameter": "shoulder_width_scale",
      "mode": "scale_axis_about_anchor",
      "axis": "x",
      "anchor_node": "chest",
      "nodes": [
        "shoulder_l",